{
  "book_id": "book_demo",
  "source_unit_id": "unit_ch01_p001_010",
  "page_start": 1,
  "page_end": 10,
  "start_offset": 120,
  "end_offset": 268,
  "quote": "The crew discovers that the map is also a record of earlier failed journeys.",
  "text_hash": "aaaaaaaaaaaaaaaaaaaaaaaaaaaaaaaaaaaaaaaaaaaaaaaaaaaaaaaaaaaaaaaa"
}
